{
  "success": true,
  "operation": {
    "id": 1,
    "kind": "shuffle",
    "state": "queued",
    "targets": [
      "alice-mix"
    ],
    "started_at": null,
    "completed_at": null,
    "progress": {},
    "result": null,
    "recovery": {
      "available": false,
      "action": null,
      "reason": null
    }
  },
  "operation_id": 1,
  "message": "Operation accepted.",
  "category": "info"
}
